{
  "boundary_specification_id": "du-boundary-v0.1",
  "instrument_version": "0.5.0-draft",
  "status": "fixed",
  "domain_definition": "A domain is a relatively stable locus of recurrent improvement activity, defined for coverage and sampling rather than as an exclusive ontological category.",
  "coverage_question": "What parts of civilization's recurrent improvement activity could our Frozen Panel systematically miss?",
  "in_scope": {
    "recurrent_improvement_activity": "Institutionalized or scalable recurrent sociotechnical processes in which outputs, evaluations, or experience from one cycle can be used to modify subsequent-cycle performance or the structures that enable it. 'Improvement' is procedural here and does not imply that the resulting change is socially, ethically, economically, or technically beneficial.",
    "later_cycle_change": "The process must be capable of altering at least one of the knowledge, designs, policies, systems, capabilities, practices, or infrastructures that govern or enable a subsequent cycle.",
    "human_criticality_investigability": "It must be meaningful in principle to investigate whether, where, and under what boundary conditions human participation remains necessary on the critical path of the recurrent improvement process, without presupposing that human criticality will weaken."
  },
  "research_universe_distinctions": {
    "all_human_activity": "Human activity is not included merely because learning, adaptation, or change occurs. The activity must form part of an institutionalized or scalable recurrent sociotechnical improvement process.",
    "all_economic_sectors": "Economic-sector membership is not sufficient for inclusion. Routine production or service delivery is outside the research universe unless it participates in a qualifying recurrent improvement process.",
    "all_ai_applications": "Use of AI is not sufficient for inclusion. An AI application is relevant only when it participates in a qualifying recurrent improvement process.",
    "all_occupations": "Occupation labels are not Domain units. Occupational activity is relevant only insofar as it instantiates a qualifying recurrent improvement process.",
    "all_tasks": "Isolated tasks are outside the research universe unless their outputs, evaluations, or experience feed into a subsequent improvement cycle.",
    "generic_automation": "Automation that merely substitutes for or accelerates execution is not sufficient. It must participate in a recurrent process capable of modifying later-cycle knowledge, designs, policies, systems, capabilities, practices, or infrastructures."
  },
  "rationale": "This boundary defines a sampling universe for civilization-scale recurrent improvement while excluding generic activity, routine execution, and AI use per se. 'Institutionalized or scalable' includes formal organizations and institutions as well as reproducible or propagating processes such as scientific communities, open-source communities, markets, and decentralized networks; it excludes purely private one-off self-improvement. Fixing this boundary is prospective for Domain candidate construction only. It does not establish or lock a Domain Universe, imply that a Singularity will occur, or authorize Wave 0.",
  "fixed_at": "2026-08-14T14:05:55Z"
}
